label	text_a
0	随机的驱动盘是VISTA专用的！不国XP的驱动官网上都有！可是显卡的驱动下载了居然安装不了，提示文件损坏！去NVI的官网下了个专用的，解决掉了！！！音响虽然是立体声，但声音很尖！
0	没包，没胆，没鼠标，系统安装XP要求系统盘的版本比较高，建议大家不要轻易升级主板BIOS.
0	本书有删减，也就是出版社的编辑自律加觉悟高，或者说是被“和谐”了。买这本书建议大家三思。而我还是去香港买原版的吧。
1	笔记本+所谓的原装包+瑞星+使用20元东?= 价格4279￥ 价格很满意。 完美屏 硬盘通电4小时
1	还是挺好的。特别是读前几篇的时候。卡尔维诺是一个文体和文章内容的大师，能从别人注意 不到的地方发现很好的题材，用很好的讲故事手法写出来。将世态，哲学，古代传说，当代精神融解的那么好，确实功力不凡。至于缺点么，就是到故事的雷同，越读到后面感觉越明显。就像书中所说的“到后来忽必烈汗发现，马可波罗所讲的城市其实是同一个城市”，在这多个城市和一个城市之间，处理的还是让人觉得有雷同感。
0	此书质量不好,买回来一看书中出现断页146-179页,本来想马上送人的,结果因一本书还要全部退货,耽误我们的时间
1	自然环境一流，宾馆内部装饰（附楼）也相当不错，说不上豪华，但是很整洁清爽。总体感觉是宁静写意。
0	送的鼠标太垃圾了，按起来硬不说了，还有噪音，手感也超不好，只能在买一个了
1	原以为是很简单、老套的故事，却没想到让我一读难忘，欲罢不能。现代的都市生活，每天忙忙碌碌，工作压力越来越大，却枯燥麻木。爱是什么？两个人真的能相守一生吗？很多时候迷茫，怀疑。看过这本书后，虽然明明知道是写出来的故事，但是很让我感动，主人公对爱的执着，真心的相守，让我的心占得满满的，生活可以平淡，只要和真爱的人携手一生，足矣！
1	早餐太差，无论去多少人，那边也不加食品的。酒店应该重视一下这个问题了。 房间本身很好。
1	1、样子不错，还是ThinkPad！2、配置超强，各种功能一应俱全；3、重量只有2公斤，很轻，携带方便；4、配的原装包质量上乘！
1	大品牌质量优保证，京东买东西行货，带发票，售后有保证，机子配置不错，散热也好，完美屏幕这个很重要哦。
1	酒店位置离虹桥机场很近.硬件也好.自租餐服务尚待提高.
1	不错，感觉很超值！京东这次送货很快！！！不错，感觉很超值！京东这次送货很
1	酒店的位置不错，附近都靠近购物中心和写字楼区。以前来大连一直都住，但感觉比较陈旧了。住的期间，酒店在进行装修，翻新和升级房间设备。好是好，希望到时房价别涨太多了。
1	功耗真的是很低，CPU只有5.5W运行几个小时后就底部有点点热，电池太强劲了反观我的小黑X61 看着电量迅速下降啊最多2个多小时。早上安装win7速度相当的不错没有感觉明显的延迟。
0	没什么感觉，只是觉得图片还蛮好玩的！至于英文方面，反正对我而言，不会想用这本书提高什么英语水平就对了。
0	非常不行，三星的携程定290元，说景观房，其实什么都看不到，连大马路都不繁华。火车站附近佳丽4星，协议价298。只能说这变价高了，而且很老破破的样子，一点花园的感觉都没！其余一般。
1	这本书涵盖的知识面比较广，贴近日常生活，适合一看再看，很有价值的一本书。我小义女收到之后常常抱着书不放，很宝贝的，这套书够她看一阵子了，毕竟内容丰富啊。里面有一些知识啊比如饮食习惯比较美国化，妈妈讲解的时候会比较不直观，因为宝宝无法与现实生活联系啊。还有比如忙忙碌碌镇的打字机，时代太久远了，大人都没概念了，何况中国的小朋友。如果中国人也能出一套类似这样的书就好了。
0	这本书没读到底，不是特别喜欢。完全可以用序中的评价来表达我的感受：可以包容，却不想实践。除了物质，我们要追求的还有很多。
0	太小了，字看得太累人了，不太适合商务机使用； 原装系统太慢，改了XP，但是自己水平有限，不伦不类的； 价格贵，性价比低， 中午付款，下午价格就降了100元，郁闷啊。 能否多送一些东东啊？？
1	外观很漂亮，开机也很快，上网配置也很全，摄像头，麦克风，网卡等都很齐全。 很轻巧，以后就要带上它一起到处跑了。还配置了放大镜软件，不用担心屏幕小看不清楚了！！
1	我和孩子都很喜欢的书。画风清新可爱，尤其是翻译的好，句子简洁押韵。我注意了一下，译者大都是我国的一些儿童文学作家，以前就在《幼儿画报》之类的杂志上多次见到他们的名字。我认为这也是这套书最好的地方。和《汤姆小兔》一起买的，相比而言，后者更侧重孩子的心理描写，很细致。但由于采用了第一人称，宝宝有时似乎不是太明白。
1	我4月23日晚入住的该酒店,前台小姐先给了我一个两幢楼之间的一个房间,很是不满意,去前台给换了一个,还可以.觉得酒店是不应该先把不好的房间先给客人的!! 我是从前山坐索道上山开始游览的,带孩子和母亲,走到该酒店的位置也确实该休息了.排云亭的位置很近,风景我觉得也是最美的!也去西海大峡谷走了一段,确实美.觉得从前山上\后山下的话,住该酒店的位置刚好是一半的位置.早晨去丹霞峰看日出,要爬一个锁着的铁门,有些扫兴.看日出到现在也总觉得太阳是从西边出来的!哈哈!黄山确实不错!! 补充点评 2008年5月12日 ： 我喜欢旅游.我的QQ:410073425
0	不是内容不好，是书质量问题。请问当当会不会有盗版书啊？146直接到了179缺了30页。退换均要一个月时间。狂晕。。当当就不能给顾客把把质量关？另外把退换弄得快点方便点消费者吗？以后再在当当买书都有阴影了。
1	物有所值,看来安徽人民币江苏人民是在得多
0	宾馆竟然不能提供网络调试服务，我做了一次兼职的网管，呵呵！很有面子，去得那天天气冷，刚开始有点不太适应，要空调遥控器，说现在不提供；要加被子，说没有，当时很郁闷，不过做了兼职网管之后很快就提供了这两样东西，很开心 另外，前台太小，性价比不高 补充点评 2007年10月22日 ： 顺便说一下，前台竟然不知道长途电话的收费标准
1	速度比想象中快，而且还可以用超频模式，增加15%的CPU速度。硬盘性能也很好。电池耐用。
1	写的很有趣，语言很生动，现在沉浸在洋流的故事中（书里虽然只有一个洋流的故事，但是会让你开始对洋流产生浓厚的兴趣~~）。如果没有地图册的话（地图也不太管用，地图册，有详细内容的那种）最好停止阅读，否则就跟看天书似的。（当然我说的是一般人）另外不好的一点就是书的内容可能比较旧，好在有的过时的内容已经被标注出来了，不爽的是作者不知道指南针是中国造的……当然，每个时代都有局限性，平静……
1	现在觉得还是值得购买的.我们现在听了近一个月,基本上能背出第一本来,第二本已经在听了.字还没认.每天在家就听,想想反正还小,上小学前三年功夫,相信不管怎么样,总是能全部弄熟了吧.一千多个词汇量,最主要还有语感,还有自然科学知识.至少家里总是有了英语环境.
1	去住了四晚，总体感觉不错，首先位置好，离油麻地地铁B2出口很近，步行最多三分钟。其次服务好，我说的普通话，没发现有什么歧视之类的，有天我们不打算打扫房间，估计是主管之类的还专门跑到房间来敲门问一会还需要打扫卫生吗；打扫卫生的阿姨也很热情，对我们说早上好；门卫也热情，对我们微笑，害得我妈高兴一天：）。第三房间比想象的好，不算太小，但很干净，也很安静，先前还说住重庆大厦，后来去看了下完全要不得，幸亏没去。第四价格还不错吧，在携程定的，四晚2266元，押金500元。下次去还住那里吧：））
1	东西不错，外观设计的好，做工精美，质量可靠，京东的送货速度很快！ 京东的东西质量还是比较放心的，没有多大问题，包装也不错，发货速度赞一个，基本当天都可以发货。东西刚用上，很不错，比想象中要好。
0	当当网的服务非常差，连同它们的客服也是敷衍了事，简直就是一种无人管理的地步，在他家买东西，出了事就别想解决，这种公司，离关门不远啦！虽然是个黄金VIP买家，以后也再也不会来了！
1	从接触这本书开始，引起了我对金融危机和我国经济发展的强烈关注。目前媒体上很多这方面的评论，但基本面都是认为经济已经转好，金融危机对我国的影响不大，而且从国家统计局公布的第一季度经济运行数据来看，似乎也是这样，但有一点值得注意，北京第一季度CPI指数下降了0.5％，食品类价格指数反而上升了4.5％，这是不是通货膨胀的一个信号？看完书后，对目前的经济形势有了太多的疑问。
1	帮同事订的，以下是他给我反馈：It was excellent and I can recommend it to anyone else to stay there. My room was on the top floor, the 8th floor and very nice. Suggest always ask for the 8th floor, even though I did not see the other floors.
0	自提的机器，开机正常，但屏幕没有背光。直接到楼上去找京东客服。
1	也许是现在的快餐书看多了，咋一看到这本《穆斯林的葬礼》很不习惯。作者有着非常好的文笔，再加上女性的细腻，将一个穆斯林家族的兴衰史清晰的展现在我们面前。将父女两代的故事间接的穿插，完整的讲述了这个以玉为命的家族故事。不知不觉的被她所吸引，为新月的命运揪心难受。最后看到她的死，更是难受。只能说，作者的文笔造诣深厚，读这本书就像本好茶，可以细品。而快餐书，就只是快餐而已。
1	早就听说此书，和朋友聊起来，听说潜规则“从某演员被导演潜规则了开始“。决定买本书拜读。感觉作者被正面的历史熏陶太久，故有发现潜规则的喜悦。读一读鲁迅关于吃人的感慨，再看看柏杨的历史年表，我这样的非专业人士也可以感觉到历史的黑暗。黑暗固然可怕，比它更可怕的是习惯黑暗、向黑暗低头！只要我辈高举德先生赛先生的伟大旗帜，不怕牺牲，心中就会有光明。世界就会有光明！
0	不知道这套书为什么那么热销，但是我对他的感觉不好。比如我看到书里面提到卡梅拉在海里尿尿（如果我没记错的话），所以我买了三套退了两套，另外一套因为已经送出去了。唉！我想孩子的教育还是选择品格教育的比较好吧，比如我和最好的爸爸啊，这种书看了能培养孩子与父亲之间的感情。虽然这套书的质量、印刷都不错，但是这些内容似乎不能帮助孩子品格塑造啊。如果我說的不对，希望能跟我私下交流. sarah.liuhui@qq.com
1	5699返600还送很多东西，比神舟类似配置的还要便宜。用过很多笔记本电脑，这个是第一次自己买着用的，非常满意，外观也不错，还配有正版的vista。
1	外观时尚，送的鼠标也很漂亮也好用，就是送的电脑包根本就装不下。京东的客服说是随机送的没法换。
0	份量比较重。屏幕边框太宽。外壳容易印上指纹。蓝色指示灯太刺眼。只有一根内存插槽，不方便升级。
1	评论之前已经写过了。看看大家的留言，好书真是不用作广告啊！今天专门补打分“5星”。
0	散热，头疼。 系统超级难折腾，想到这里就想着村里还保证系统能装好。。。 声卡驱动折腾了半天。
1	这里交通和饮食便利,服务态度好,性价比不错,就是热水不太热,值得推荐.
1	不错的饭店，饭菜做得也不错，来潍坊这里值得住住
0	为了确保没有问题，我还是选的自提，上周六刚拿到验货键盘就坏了，只能返修，啥辙没有，忍
1	再补充一些评论，这本书是报业系统内部所有人都推荐的书籍，因此，看到我在当当上购买到了此书，同事也纷纷托买。对于业内新手来说，是一本很专业的指导书籍。而许多从业多年的老媒体人，也时常要翻翻这本书，规范自己的新闻思路。如果你是业内人士，自然不需要我来多说。如果你是正在学习新闻专业的学生，或者是即将入行的新人，就请沉下心来细细读。
0	该酒店严重名不副实，所谓的商务间豪华间就是一般的标准间，套间就是标准间多出一块，设施陈旧，严重上当。
0	这本书写的不怎么样,好像是杜拉拉在写日记一样，很多内容没有实质的励志性信息，就跟普通的一般公司职员的情况差不多，只是在强调杜拉拉是怎样一步步发展的，有点像是在炫耀自己的能力。
1	回想起我们的QDII,回想起当年的豪言壮语，我们要到国际资本市场上去拼搏，大有一番“乘风破浪会有时，直挂云帆继沧海” 之势。 而如今“执手相看泪眼，竟无语凝噎”。自己也在一家外资银行工作，我们也销售海外基金，复杂的结构性票据，不要说客户，就连我们自己有时候也搞不清楚。现在看来，是他们早就设计好的，我们根本算不过人家！
0	要是内存是2G就更好了。京东找运输公司的时候也不问下能不能发到收货地址的吗？？？？？？还是我自己又再花了20块钱去拿的货。。。。。。。
1	屏幕颜色很好，键盘手感也很好，价格相当实惠。硬盘声音小，发热也可以，最具性价比的上网本。
0	我想多数人是因为爱玲才买了这本书，总的感觉不好，可能仅存一点价值是如果想进一步研究张爱玲就不妨看一下，人品较差，爱玲比较冤。不过，也能体会出，这个人口才一定不错，外表看来素质修养都还好，知识面也宽，典型的清末书生，却是属于那种流连于秦淮河畔的那种
0	感觉不稳定，用到十二天的时候出现了一次蓝屏（开机十小时以后）。
0	今天从网上看到对此书的评价,内容讲的是百龙公司老板孙寅贵恶意拖欠燕郊工地的有关款项,被对方以书面控诉的过程及内容,看后颇感震惊.本来读了孙老板的<公平定律>之后就感觉书中内容象在为自己开脱或辩解(与其兄弟反目成仇的故事和诉说自己在赤水投资失利的故事),今闻此事既在意料之外又在情理之中,一个为了金钱和自己的兄弟自相残杀的人,一个为了泄愤而拖欠工人款项的人,怎么能和一个有社会责任感的人画上等号!小到自己的同胞家庭,大到在社会上与对手的生意,他的做法公平吗?孙寅贵太有?才?了,忽悠不知情的读者!孙寅贵太有?财?了,炒作扭曲的真理!这或许可称作一种?富人的公平?吧!......(在当当网每篇书评的回复中,有关于此事的详细介绍)
0	在当当网买了几次东西了,感觉不是太好.服务上总是出现一些小问题.我19日下的订单,到了24日打电话还在配货,而贵网明明白白说按规定在2_5天内发货.记录显示直到30日才发出来,这是一种什么服务,糟糕透顶.上次东西有问题要退货,我问能否早些退货,客服人员回答不能,只能在5个(7个)工作日内办理.一直等2周以后打电话给客服人员才又拖了几天解决.感觉规定就是给顾客制定的,公司人员无所谓,让人缺乏信任感.客服务倒是服务态度很好,但谁会无聊没事找客服.我想大多数客房要求很低,只要把你承诺的话做到就对了,并不希望你们做得有多完美..好好改进吧,否则再过几年这个世界还不知有没有当当网了.
0	酒店设施烂的可以,说明了宽带上网,永远是上不去的,跟去年十月的时候一样,象如家这样的酒店,携程还是不要合作的好...最令人气愤的是,三点到达酒店(那个小巷子非常难找,在一个破旧不堪,就要拆除的巷子里),说是房间没有,要到6点以后才能入住,后来才知道是他们为了赢利,把房间租出去作钟点房,结果客人延迟退房,所以要我们等,一开始还不肯说,是我们多次询问,他们不耐烦了,才告诉我们真相...而且明显感觉到他们对于经销商带来的客人根本无所谓,也不在乎服务态度,其他自己入住的客人,他们倒是很热情,我就搞不懂了,我们付的费用不比别人少,为什么要受到这样的对待. 另外,每次预定携程的房间,只要订的是比较高楼层的房间,基本上都是最底下的那层,如果是2-4层的商务层,就必给的是2层的,去杭州的华侨饭店也是,我也上去看过了,房间是空着的,可是就是不给我们...凌晨一点来的旅游团,全部入住4楼...这个前门如家的前台是在一楼半,还好没订一楼的,因为一楼就是地下室,象监狱一样的一条狭长的窗户,房间更加阴冷潮湿...那么这里的2楼也就是一楼...无语......说是交通及其便利,走到前门也要15分钟... 关于设施,其他的也不谈了,那个床是简直令人发指....睡上去都可以明显感觉到老化的弹簧一条一条的折磨着你的背,床单和被单都是潮潮的,我很怀疑他们有没有妥善的清晰更换...... 这样的合作伙伴,居然携程也会愿意合作...令人费解...别因为这些供应商把你们自己的招牌砸了!!...
0	我是5月初在携程上预定该酒店1间标间加床的，预定价格为320＋100。 5月13日早上入住时被告知无房间，要等中午才有房间，我询问是标间还是三人间时，小姐很不耐烦地表示会为我们优先准备三人间。中午回到酒店，前台小姐说标间还没有打扫完，所以推荐我们改为三人间，当我询问价格时，小姐先是模糊地说跟标间加床后的价格差不多，后来又笼统地说四百多，最后在我一直要求下才很不耐烦地查看了下电脑后报价420,于是入住。 14日的自助早饭比较丰盛，服务员的态度也比较好，但是到15日却大不一样了，稀饭是冷的，豆浆没有了却不见有服务员添加，品种也少了许多，服务员聚在一起开心地聊天，根本不去理会客人有什么需要。（15日离店时在酒店门口赫然发现“庆祝南平市首届科技成果交易会5月13日胜利召开”，于是恍然大悟。） 15日上午结帐，刷卡时突然发现金额是每天470元，于是询问前台，被告知三人间就是这个价格，在我一再坚持下，前台打电话给13日早上当班的服务员，没想到那位小姐居然改口说13日入住时给我们的价格就是四百多。我当时就说这并不是钱多少的问题，而是商家诚信的问题。 不知道各位看客是什么感觉，但是就我个人来说，是再也不会去武夷山了，即使去了，我再也不会住在这样一个没有基本诚信的酒店，忍受每天晚上小姐的准时骚扰了。
0	看了网上那多的对它好的评价因此才决定购买.没有想到大失所望!只是把一些常用的英语单词归类而已.对我来说没有任何帮助,也没有别人说的开心搞笑!以前我上初中时,我的英语老师就已经让我们学着将英语单词归类了.非常一般......
0	并没有宣传的那样好,且没有什么实用性,更没有娱乐价值,现在也没有人糊墙了,真不知道,拿这本书做什么???
1	原来说系统是配DOS，收到的却是正版Vista 2、原来说硬盘是250G，收到的是320G
0	评个鸟~~~~~订了三次投诉两次都没给我送过来，连书长什么样子都还不知道！每次投诉就只会说对不起，根本就没给我解决问题，没书又不说，就直接给寄其他的过来，前后都三个月了，一共订了几次，算了，不订了。
0	总台服务还可以，房间实在不怎么样，空调很吵，床居然是一边高一边低的，这个房价实在是不值得，下次不会选择。
0	我买的怎么是旧书啊？上面胡写乱划了一堆，而且光盘也不对，我买的是商务英语，光盘是生活英语的。当当网卖的什么破B玩意！工作人员都是吃S长大的？
0	酒店设施还行，服务超级差，服务态度也很不好，我们本来是在这里开会，结果各个部分互相之间很难沟通哦
1	地理位置还可以，在西湖边上，附近有一些大排挡，饮食也比较方便。酒店服务很好，服务生和前台人员都很热情，房间大而整洁，价格性价比高，如果下次去西湖还会入住。
0	摄像头差了点。屏幕时8.9，键盘时全尺寸的看上去有点不协调，鱼和熊掌不能兼得没办法了哈哈。
0	LED屏和屏幕外面的塑料壳子压得不实？侧面看有个很大的缝隙，压住壳子和屏幕，缝隙就缩小了。这个能不能换货？ 运行速度太慢。 降价太快。
0	相对来说，比起东莞，深圳的酒店，该酒店服务质量还是略有小疵。略欠热情与礼貌，有点爱搭不理的。举个例子，在该酒店住宿的最后一个晚上，他们忘了给新拖鞋，我总共打了三个电话，才送过来，当时看酒店环境，似乎并不是非常忙碌。
1	文字加图的形式，开本很大，字和图都很大，图画得也很好，看得出来编辑对本这套书是下了功夫的，内容也非常好，读起来很有意思，很温馨，感受得到德国的田园浪漫的气氛，很舒服，我是非常喜欢的：只有经得住暴风雪考验的友谊才是真正的友谊，他们喜欢启明星，我儿子喜欢月亮，孩子的心理都住着一个梦想，对于月亮和星星，他们是那么喜欢，和他们总在一起，我也觉得月亮出来了很美！还没读完，继续吧！
0	写的一般吧，并不像推荐的那样好，如果实在书店可以先翻看一些的话，我想是不会去买的。
0	我非常不满意新月阁客栈，如果有零分可以选，我宁可一分也不肯给.他们的服务太差了.明明含早餐的,居然早上服务员全然不知道,还是我本人大清早冒雨出去买的。更让人心寒和气愤的是:在中秋节的早晨,服务员在我们毫不知情的情况下,把房间转卖给别人,把我和一对美国夫妇赶走了。我和周围的几家客栈谈起此事,大家都非常震惊,居然有这种人!我强烈建议大家从此以后不要在这里住了。而且价格是附近的客栈的两倍.
0	这套猫和老鼠，本来定了打算送给朋友的，可是第一次送货十多套，包装每一个好的，质量都有问题。听送货的说换货更麻烦，不如直接退货，再重新下订单，如此反复数次，我要的数量还没送齐。投诉无门！！！！伤心啊！！！！不过总的说这套盘只能说是物美价廉，看后发现不是正版，图像质量一般，送人要想清楚！
0	刚取的时候没发现屏幕有问题，拿回家之后发现右上角有一个小红点，运气不够好，不过不影响使用。后来用的时候，看电影时偶尔卡机，不知道什么问题。
1	今天刚刚参加了考试，考试的指定书目就是这本《美学十五讲》。总而言之，这本书是挺不错的，内容由浅入深，语言朴实易懂，没有用非常专业的术语来论述问题，而多采用例证的方式来论证观点，并包罗了美学的主要研究问题，对于想要涉猎美学知识的人来说是本很不错的书。然而作为专业复习，这本书不太好。这本书的观点比较分散，名词概念往往没有给出确切的定义。
0	对小孩子很有用，可对于我，我想是买错书了。“大学生朋友”指的是年纪大一写的学生例如高中生，初中生，而不是大学生。当当的服务还是很好的，赞一个。
1	手感很好，样子很经典。加了1G内存，换了XP，跑起来很快。暂时没发现什么问题
1	看过很多这方面心智的书了。不过这一本，优美轻柔的文字，带着我身心都离不开了这本书。一个字一个字，如同读教科书般，再仔细地“吃”进去。久违的好书！应该说，居然有这么好的书！我还没有读完，估计会一直珍藏在自己的枕边，随时拿出来拜读，就算是我人生的一本教科书吧。感谢译者，用这么柔美的文字，轻柔地敲开了我的心房。这将是改变我人生的一本书。。。。。。
0	外放音量不是很大，高音有点小尖低音不足，如果环境不是太吵闹可以应付正常使用
0	1、门童不专业，我们是晚上10点到的，下出租时，没人开门不说，连箱子都要自己拿。 2、房间太小，浴室也小，不象是四星的标准。 3、结帐时竟然说两间浴袍不见了，我们入住时根本就没见过浴袍。还想问酒店要呢！ 4、入住和结帐都慢，总之以后再去，不会再入住了。
